{
  "schema_version": "research_integrity_artifact.v0.1",
  "artifact_id": "hummbl-tuples-v2-spec",
  "title": "Typed Governance Tuples for Bounded Delegation v2",
  "maturity_state": "INTERNAL_TECHNICAL_REPORT",
  "claim_postures": [
    {"claim": "21 core tuple schemas defined", "posture": "OBSERVATION", "evidence_ref": "schemas/ directory"},
    {"claim": "26 validated examples", "posture": "MEASUREMENT", "evidence_ref": "examples/ directory"},
    {"claim": "Tuple envelope architecture separates universal from governance layers", "posture": "DESIGN_PROPOSAL", "evidence_ref": "ADR-004"},
    {"claim": "Tuples enable bounded delegation in AI-native systems", "posture": "HYPOTHESIS", "evidence_ref": null},
    {"claim": "No prior work combines typed tuples with AI governance envelopes", "posture": "HYPOTHESIS", "evidence_ref": null}
  ],
  "risk_checks": [
    {"risk_class": "R1", "status": "UNRESOLVED", "evidence_ref": null},
    {"risk_class": "R2", "status": "UNRESOLVED", "evidence_ref": null},
    {"risk_class": "R3", "status": "PASS", "evidence_ref": "claim postures distinguish hypothesis from observation"},
    {"risk_class": "R4", "status": "PASS", "evidence_ref": "reproducibility manifest complete"},
    {"risk_class": "R5", "status": "PASS", "evidence_ref": "methods documented in spec"},
    {"risk_class": "R6", "status": "PASS", "evidence_ref": "human authorship explicit"},
    {"risk_class": "R7", "status": "PASS", "evidence_ref": "AI use disclosed"},
    {"risk_class": "R8", "status": "NOT_APPLICABLE", "evidence_ref": null},
    {"risk_class": "R9", "status": "NOT_APPLICABLE", "evidence_ref": null},
    {"risk_class": "R10", "status": "PASS", "evidence_ref": "MIT license"},
    {"risk_class": "R11", "status": "NOT_APPLICABLE", "evidence_ref": null},
    {"risk_class": "R12", "status": "PASS", "evidence_ref": "no press-style claims"},
    {"risk_class": "R13", "status": "PASS", "evidence_ref": "version history maintained"},
    {"risk_class": "R14", "status": "PASS", "evidence_ref": "no prestige borrowing"},
    {"risk_class": "R15", "status": "PASS", "evidence_ref": "no namespace colonization"}
  ],
  "authorship": {
    "human_authors": [
      {"name": "Reuben Bowlby", "responsibility": "Conceptualization, methodology, writing", "orcid": "0009-0002-5620-1103"}
    ],
    "agent_contributions": [
      {"agent": "Codex (GPT-5.5)", "role": "execution_system", "scope": "Schema generation, fixture creation, test writing"},
      {"agent": "Claude Code", "role": "assistant", "scope": "Spec drafting, review feedback"}
    ]
  },
  "ai_use_disclosure": {
    "material_assistance": [
      {"category": "coding", "description": "Schema and validator implementation"},
      {"category": "drafting", "description": "Spec document sections"},
      {"category": "review", "description": "Consistency checking across spec and schemas"}
    ],
    "citation_fabrication_check": true
  },
  "independent_review": {
    "reviewer_not_author": false,
    "review_completed": false,
    "reviewer_disagreements": [],
    "unresolved_objections": []
  },
  "reproducibility_manifest": {
    "methods_preserved": true,
    "versions_preserved": true,
    "environments_preserved": true,
    "data_lineage_preserved": true,
    "seeds_preserved": null,
    "negative_results_preserved": true,
    "non_reproducible_parts": []
  },
  "prior_art_review": {
    "adjacent_disciplines_searched": false,
    "direct_neighbors": [],
    "partial_precedents": [],
    "convergent_work": [],
    "disconfirming_sources": [],
    "novelty_challenge_completed": false
  },
  "ethics_determination": null,
  "venue_policy_check": null,
  "correction_contact": "reuben@hummbl.dev",
  "version_history": [
    {"version": "0.1.0", "date": "2026-03-15", "change": "Initial spec draft"},
    {"version": "0.2.0", "date": "2026-04-17", "change": "TUPLES v2 with envelope architecture"}
  ]
}
